{
    "schema_version": 1,
    "schema_type": "versions",
    "latest": "1.1.0",
    "latest_stable": "1.1.0",
    "versions": [
        {
            "name": "1.1.0",
            "loader": "built-in",
            "release_date": "2023-11-10T22:03:02Z",
            "stable": true,
            "changelog": "* Fix: Fixed an issue with HarmonyLoader using the wrong directory when looking for 0Harmony.dll\n* Refactor: Moved classes that don't need to be used by mod using the library to the `Py.LibLocalization.Internal` namespace.",
            "demeo": {
                "min": "1.32"
            },
            "file": {
                "name": "Py.LibLocalization-v1.1.0.zip",
                "url": "https://github.com/JustPyrrha/Py.LibLocalization/releases/download/v1.1.0/Py.LibLocalization-v1.1.0.zip",
                "sha256": "6d6e125b9bb8ceb74c8a97fbd015b9867dfc8f7437a130b099b8288ed2e45356"
            }
        },
        {
            "name": "1.0.0",
            "loader": "built-in",
            "release_date": "2023-10-26T02:51:16Z",
            "stable": true,
            "demeo": {
                "min": "1.32"
            },
            "file": {
                "name": "Py.LibLocalization-v1.0.0.zip",
                "url": "https://github.com/JustPyrrha/Py.LibLocalization/releases/download/v1.0.0/Py.LibLocalization-v1.0.0.zip",
                "sha256": "2fb9b629c724409a56f95c0a6221a222ed2a2f4b3ca9c985c2e1c84a85ee0d42"
            }
        }
    ]
}