{
    "schema_version": 1,
    "schema_type": "versions",
    "latest": "1.0.0",
    "latest_stable": "1.0.0",
    "versions": [
        {
            "name": "1.0.0",
            "loader": "built-in",
            "release_date": "2023-10-29T07:37:15Z",
            "stable": true,
            "demeo": {
                "min": "1.32"
            },
            "file": {
                "name": "Py.LibNetwork-v1.0.0.zip",
                "url": "https://github.com/JustPyrrha/Py.LibNetwork/releases/download/v1.0.0/Py.LibNetwork-v1.0.0.zip",
                "sha256": "8cd38924cab8c38797bcf667fe59b862078eabd75924ae9342a9464080209a97"
            }
        }
    ]
}